ad_id,list_time,subject,body_short,price_usd,price_byn,company_ad,ad_link,area_total,balcony,condition,floor,floors_total,building_year,area_code,location_lon,location_lat,address,contact_name,rooms,district,area_living,building_type,area_kitchen
1067430028,2026-06-05T16:36:45Z,Сдается квартира для большой семьи МЕТРО АЭРОДРОМНАЯ,"Сдаётся трёхкомнатная квартира с дизайнерским ремонтом ул. Игоря Лученка, д. 15 СРАЗУ У МЕТРО АЭРОДРОМНАЯ
Общая площадь 60 м.кв., 2025 год постройки.",1000.0,2866.8,False,https://re.kufar.by/vi/1067430028,60.0,4,10,20.0,25.0,2025.0,28,27.544071,53.86697,"Игоря Лученка ул, 15, Минск",Александр,6.0,170,,2,
1071833980,2026-06-05T15:34:21Z,сдам квартиру,"Сдам двухкомнатную квартиру на Партизанском проспекте,недалеко от метро, только Белорусам,без детей и животных, по договору на длительный срок, цена",600.0,1720.08,False,https://re.kufar.by/vi/1071833980,50.0,1,5,,,,27,27.584702,53.886212,"Партизанский пр, 7, Минск",катя,,,,,
1071822934,2026-06-05T13:10:43Z,"Снять 2-комнатную квартиру, г. Минск, ул. Коласа, 15","Современная   квартира после ремонта в 10- этажном блочном доме 2000 г. постройки на ул. Якуба Коласа, 15.  Первое заселение! Всё  новое!         
Сда",580.0,1662.74,True,https://re.kufar.by/vi/1071822934,46.1,,,8.0,10.0,,23,27.587379,53.92082,"Якуба Коласа ул, 15, Минск",ООО Артель Недвижимость,,120,18.4,,14.3
1071808563,2026-06-05T11:20:21Z,Квартира 2шка Сокол,"2 шка с Соколе , мебелированная с техникой.  Желательно семье, не командировочным. Агентам не беспокоить. Договор, квартплата, залог за 1 месяц.",399.84,1146.25,False,https://re.kufar.by/vi/1071808563,61.0,3,1,6.0,9.0,2010.0,28,27.903029,53.873675,"Берёзогорская ул, 8, Минск",Наталья,4.0,245,31.0,1,12.5
1071804661,2026-06-05T10:55:48Z,Квартира в аренду,"Евро двушка в долгосрочную аренду ,",600.0,1720.08,False,https://re.kufar.by/vi/1071804661,31.0,4,10,3.0,20.0,2025.0,28,27.556513,53.862998,"Леонида Щемелёва ул, 14, Минск",Саша,,170,31.0,2,25.0
1071787317,2026-06-05T08:33:31Z,Квартира в Марселе,"В детскую куплю мебель по пожеланиям арендатора
готов сдать на месяц и несколько месяцев",850.0,2436.78,False,https://re.kufar.by/vi/1071787317,60.0,3,10,19.0,25.0,2024.0,28,27.553171,53.86004,"Михаила Савицкого ул, 37, Минск",Станислав,4.0,170,40.0,2,20.0
1071749976,2026-06-05T05:55:35Z,Сдаётся 3-комнатная квартира Победителей 53к1,"Сдаётся уютная 3-комнатная квартира. Комнаты раздельные.
Чистая, просторная, светлая и тихая квартира.
Окна с 2-х сторон - во внутренний благоустроенн",650.0,1863.42,False,https://re.kufar.by/vi/1071749976,63.0,3,,10.0,15.0,1985.0,22,27.52977,53.91942,"Победителей пр, 53к1, Минск",Эльвира,3.0,,39.0,3,8.0
1071707000,2026-06-05T05:28:12Z,Сдам 2-х комнатную квартиру,"С 11 июля сдаётся двухкомнатная квартира на срок от 1  месяца и более. Хорошее расположение. В пешей доступности: обелиск ""Стела Минск – город-герой""",550.0,1576.74,False,https://re.kufar.by/vi/1071707000,61.0,3,1,15.0,19.0,2010.0,22,27.530848,53.910919,"Машерова пр, 43, Минск",Алексей,2.0,90,31.0,1,13.0
1071716650,2026-06-05T04:31:44Z,Аренда квартиры. В живописном месте Серебрянки,"Развитая инфраструктура района: детсады, школы, гимназии, взрослая и детская поликлиника. Огромный торгово-развлекательный центр PRIZMA.Рядом с домом",488.35,1400.0,False,https://re.kufar.by/vi/1071716650,49.8,1,5,5.0,5.0,1974.0,27,27.615083,53.858325,"Рокоссовского пр, 113, Минск",Татьяна,4.0,230,34.4,1,6.1
1067957624,2026-06-04T16:59:35Z,Сдам квартиру,"Сдам квартиру в частной застройке в Центральном районе Минска. Квартира находится на первом этаже дома, отдельный вход, раздельный санузел. Высокоскор",700.0,2006.76,False,https://re.kufar.by/vi/1067957624,100.0,,,1.0,,,22,27.532079,53.955617,"Ярошевичская ул, Минск",Юлия,4.0,180,,,
1071662235,2026-06-04T16:10:30Z,Сдам 2-х комнатную квартиру,"Сдается 2-х комнатная квартира, по ул.Берута 24, к1., 3 этаж. г. Минск. Под ключ. Евроремонт, вся мебель, техника: TV, микроволновка, холодильник, сти",600.0,1720.08,False,https://re.kufar.by/vi/1071662235,45.0,1,5,3.0,5.0,,30,27.50601,53.899048,"Болеслава Берута ул, 24/1, Минск",Александр,3.0,290,30.0,3,5.0
1071661369,2026-06-04T15:58:36Z,"3комн. для длительного проживания у метро Академия наук, у парка, по пр. Независимости 80","Работаем по факту! 

Полностью укомплектована всем необходимым для длительного проживания: мебель, техника, посуда, бытовые мелочи 

Комнат: 3 (спален",700.0,2006.76,True,https://re.kufar.by/vi/1071661369,55.4,3,5,2.0,9.0,1963.0,24,27.607843,53.922342,"Независимости пр, 80, Минск",ООО КАРТА ГОРОДА,2.0,,36.3,3,6.2
1071649808,2026-06-04T13:38:18Z,"Снять 2-комнатную квартиру, г. Минск, ул. Лучины, 24","Уютная 2-комнатная квартира в Лошице на длительный срок

Сдается просторная и уютная двухкомнатная квартира в одном из самых комфортных для жизни райо",523.23,1500.0,True,https://re.kufar.by/vi/1071649808,67.4,3,5,9.0,9.0,,27,27.57686,53.837673,"Янки Лучины ул, 24, Минск",ООО Артель Недвижимость,,145,41.9,,8.8
1071644666,2026-06-04T13:16:22Z,"Аренда 2-комнатной квартиры, Аэродромная 26А","Сдается светлая евро-двушка в ЖК «Минск Мир» 

 О квартире:
Уютная и современная планировка
Полностью укомплектована мебелью и техникой для комфортног",570.0,1634.08,True,https://re.kufar.by/vi/1071644666,38.4,3,,23.0,25.0,2022.0,28,27.546299,53.871403,"Аэродромная ул, 26А, Минск",ООО Центр недвижимости ГАЛАКТИКА,,170,29.9,4,
1071633090,2026-06-04T12:52:44Z,Просторная 2-комнатная квартира (50 м²),"Сдам просторную 2-комнатную квартиру (50 м²) на длительный срок по договору аренды. Адрес: ул. Щорса, 4Б - 5 минут до метро Грушевка. Этаж 16 (из 18).",650.0,1863.42,False,https://re.kufar.by/vi/1071633090,50.0,1,10,16.0,18.0,2019.0,29,27.520023,53.882927,"Щорса ул, 4Б, Минск",Дмитрий,4.0,55,,,
1062155452,2026-06-04T12:31:48Z,Сдам 2-комнатную квартиру по ул.Некрасова,"Сдается 2-х комнатная квартира с 01.05 на длительный срок. Еще переклеиваем обои и линолеум. Если согласны, вселится в мае, ремонт доделаем на выходны",400.0,1146.72,False,https://re.kufar.by/vi/1062155452,50.0,1,1,3.0,9.0,1984.0,23,27.586337,53.932553,"Некрасова ул, 19, Минск",наташа,2.0,,33.0,1,7.2
1071573394,2026-06-04T08:01:35Z,Долгосрочная аренда,"Квартира 1+1 (евро двушка)  хорошим ремонтов в аренду по договору.
Коммунальные включены в стоимость.",685.43,1965.0,False,https://re.kufar.by/vi/1071573394,59.0,3,1,8.0,10.0,2013.0,22,27.472979,53.93302,"Ильянская ул, 4, Минск",Татьяна,,,,,
1071550633,2026-06-04T07:01:01Z,Сдается 2 комнатная кв. район пл. Бангалор,Сдается уютная и просторная 2комн.квартира. Оснащена всей необходимой техникой и мебелью. Прекрасный вид. Удобная инфраструктура и транспортное сообще,650.0,1863.42,False,https://re.kufar.by/vi/1071550633,65.0,3,5,15.0,16.0,2004.0,23,27.583247,53.936396,"Максима Богдановича ул, 120, Минск",Елена,2.0,,42.0,10,9.0
1071550474,2026-06-04T06:58:46Z,Квартира в супер зеленой зоне,"Просторная дизайнерская квартира. Большие панорамные окна. Солнечная, светлая. Основа хорошего настроения и жизненной энергии. Высокий этаж, вид город",600.0,1720.08,False,https://re.kufar.by/vi/1071550474,56.0,1,10,17.0,22.0,2016.0,23,27.611292,53.946848,"Логойский тракт, 19к2, Минск",Джон,1.0,,25.0,2,19.0
1071486329,2026-06-03T19:23:21Z,Двухкомнатная квартира.,"В историческом центре Минска, 300м. от ж.д. вокзала,по адресу пер. Михайловский д.4, сдается на длительный срок 2 х комнатная квартира с мебелью и быт",700.0,2006.76,False,https://re.kufar.by/vi/1071486329,55.1,2,5,3.0,5.0,1951.0,28,27.55146680271068,53.89375260261745,"Михайловский переулок, 4, Минск",Василий,2.0,,32.2,3,7.2
1071471196,2026-06-03T16:49:40Z,"Жореса Алферова 7, Аренда 2-комнатной квартиры","Работаем по факту!

Сдаётся уютная двухкомнатная квартира в ЖК Минск Мир 
Квартира полностью укомплектована мебелью и техникой, выполнен качественный",750.0,2150.1,True,https://re.kufar.by/vi/1071471196,44.6,3,,6.0,25.0,2024.0,28,27.55247,53.862084,"Жореса Алфёрова ул, 7, Минск",ООО Центр недвижимости ГАЛАКТИКА,,170,38.0,4,
1071452673,2026-06-03T13:28:50Z,Сдать 2-комнатную квартиру,"Дом кирпичный, расположен во дворе, рядом парк им. Горького, набережная Свислочи.
     Две квартиры на площадке, видеодомофон, на полу ламинат, металл",650.0,1863.42,False,https://re.kufar.by/vi/1071452673,54.0,3,1,5.0,8.0,1978.0,25,27.576303,53.90031,"Первомайская ул, 20к2, Минск",Диана,3.0,200,34.0,3,8.6
1071445224,2026-06-03T12:37:28Z,"Аренда 3-комнатной квартиры, Туровского 10",Сдается трехкомнатная квартира в ЖК Маяк Минск. Ул. Кирилла Туровского 10. Две отдельные спальни и кухня-гостиная.квартира укомплектована всем необход,1200.0,3440.16,True,https://re.kufar.by/vi/1071445224,91.0,3,,4.0,10.0,,24,27.655067,53.932037,"Кирилла Туровского ул, 10, Минск",ООО Центр недвижимости ГАЛАКТИКА,,325,89.2,,
1068931455,2026-06-03T12:32:46Z,"Аренда 4-комнатной квартиры, Мстиславца 3","Актуальна к просмотру и заселению с 28 июля
4-х комнатная квартира-студия с шикарным видом, которая находится на 8-м этаже по адресу: ул. Мстиславца,",1400.0,4013.52,True,https://re.kufar.by/vi/1068931455,82.1,2,,8.0,25.0,2018.0,24,27.654097,53.927654,"Петра Мстиславца ул, 3, Минск",ООО Центр недвижимости ГАЛАКТИКА,,325,73.9,4,
1071432901,2026-06-03T10:58:54Z,Сдам квартиру,"Сдается квартира в центре Минска.Три остановки до станции метро Немига.Напротив парк Победы,Стела.Квартира после свежего ремонта. Сдается на длительны",750.0,2150.1,False,https://re.kufar.by/vi/1071432901,41.5,1,5,4.0,4.0,,22,27.52933,53.918047,"Тарханова ул, 11, Минск",Ssss,2.0,,,,
1070496251,2026-06-03T09:10:46Z,"Аренда 1-к квартира 43 м, Минск, Лошица","Сдается 1-комнатная квартира на длительный срок от собственника. 
Из мебели: шкаф с антресолями, трюмо, электрическая плита, диван, набор кухонной меб",348.82,1000.0,False,https://re.kufar.by/vi/1070496251,43.0,3,1,11.0,19.0,2007.0,27,27.565397,53.841732,"Иосифа Гошкевича ул, 16, Минск",Юрий,2.0,145,18.0,1,10.0
1071423341,2026-06-03T09:10:42Z,квартира,"Сдам 1-комнатную квартиру с 16-го июля 2026г. Квартира в отличном состоянии, современная, чистая. Рядом находятся торговые центры, железнодорожный вок",575.55,1650.0,False,https://re.kufar.by/vi/1071423341,48.2,1,5,10.0,10.0,2018.0,28,27.548662,53.885262,"Могилёвская ул, 24, Минск",Юлия,,,15.9,4,9.4
1071420650,2026-06-03T08:52:03Z,Сдаю 3-х комнатную квартиру,"Сдается 3-х комнатная квартира на длительный срок!
Две остановки до метро Малиновка. Под окнами садик и 5 мин до школы. Поликлиника, аптека, магазины,",600.0,1720.08,False,https://re.kufar.by/vi/1071420650,68.0,1,5,7.0,9.0,1994.0,29,27.457088,53.847857,"Космонавтов ул, 37, Минск",Татьяна,3.0,150,45.0,1,8.7
1071407131,2026-06-03T07:53:53Z,Современная 2-комнатная квартира в аренду в ЖК ''Гранд Хаус'',"Сдается современная просторная 2-комнатная квартира 78 кв.м. в ЖК ""Гранд Хаус"" по адресу: пр-т Дзержинского,19.

В квартире есть вся необходимая мебел",900.0,2580.12,True,https://re.kufar.by/vi/1071407131,77.5,3,,16.0,18.0,2017.0,29,27.516098,53.886154,"Дзержинского пр, 19, Минск",ООО Центр недвижимости ГАЛАКТИКА,,55,68.0,4,
1071332058,2026-06-03T04:28:39Z,Иностранным гражданам**Foreign students**2-комн.50м²**м.Спортивная,Сдаёт собственник. Минимально–3 месяца. Максимально–1 год. Регистрация договора в РСЦ. Можно покомнатно. В одной комнате может проживать 1 человек.  И,550.0,1576.74,False,https://re.kufar.by/vi/1071332058,50.0,1,1,5.0,5.0,1973.0,30,27.477533,53.922427,"Ольшевского ул, 75, Минск",Михаил,1.0,205,34.7,1,6.2
1071330814,2026-06-03T04:01:21Z,Сдаётся 3-хкомнатная квартира с сентября,"Сдаётся евротрешка в ЖК Минск -Мир. 
Первое заселение.
Квартира светлая, теплая. Имеется две изолированные спальни и кухня- гостиная. 
Окна выходят на",700.0,2006.76,False,https://re.kufar.by/vi/1071330814,54.0,3,5,15.0,25.0,2022.0,28,27.55118238137212,53.86120552757319,"Жореса Алфёрова ул, 11, Минск",Ольга,5.0,170,,4,
1071319419,2026-06-02T18:10:53Z,Сдается 1-ая квартира,"Сдается уютная 1-ая квартира. В эко зоне. Рядом парк валунов. До метро 15 минут пешком и можно на транспорте добраться. Есть стиральная машина, холоди",500.0,1433.4,False,https://re.kufar.by/vi/1071319419,46.0,1,5,10.0,12.0,2014.0,24,27.688310825937158,53.933667198501176,"Шугаева ул, 25, Минск",Юрий,,280,16.7,,11.6
1071318657,2026-06-02T18:02:01Z,Ищем квартиру,"МЫ САМИ ИЩЕМ КВАРТИРУ!!!
МЫ НЕ СДАЁМ!!!

Три студентки снимут квартиру на учебный год 2026/2027, с конца август и по июль.
Рассматриваем квартиры с 1,",383.7,1100.0,False,https://re.kufar.by/vi/1071318657,16.0,,,1.0,1.0,2026.0,29,27.485406787904083,53.85692569132988,"Чюрлёниса ул, 7, Минск",Полина,2.0,,,,
1071315075,2026-06-02T17:19:45Z,Сдается двухкомнатная квартира,Без посредников на длительный срок,523.23,1500.0,False,https://re.kufar.by/vi/1071315075,61.0,3,5,1.0,9.0,,25,27.63348985156537,53.908590512279645,"Филимонова ул, 8, Минск",Людмила,,240,36.0,1,10.0
1071314493,2026-06-02T17:12:30Z,Сдать квартиру,Сдается двухкомнатная квартира на длительный срок.,480.0,1376.06,False,https://re.kufar.by/vi/1071314493,68.0,1,1,7.0,,,30,27.420769,53.889555,"Скрипникова ул, 7, Минск",марфина,3.0,,35.0,1,10.0
1071302450,2026-06-02T15:59:35Z,Сдача квартиры,"Сдам квартиру на длительный срок. Ремонт косметический . Без мебели.  В хорошем районе.  .
Всю информацию узнавать по телефону.",348.82,1000.0,False,https://re.kufar.by/vi/1071302450,47.2,1,1,4.0,5.0,,24,27.634666,53.946705,"Калиновского ул, 71, Минск",.Алиса,,100,31.7,1,6.2
1071272514,2026-06-02T11:16:20Z,Квартиры,"Сдается уютная, современная квартира рядом с метро.Евродвушка в ЖК ""Vogue"" г.Минск ул. Макаенка 12А. Квартира укомплектована всей необходимой техникой",540.67,1550.0,False,https://re.kufar.by/vi/1071272514,45.0,3,5,4.0,19.0,2018.0,24,27.624824646700766,53.9217150872239,"Макаёнка ул, 12А, Минск",Вячеслав,2.0,,35.0,,5.0
1071257455,2026-06-02T09:47:39Z,сдаю 2-х комнатную квартиру,"На длительный срок сдается в аренду уютная двухкомнатная квартира с отличным ремонтом, расположенная в живописном и зеленом районе в одноподъездном до",700.0,2006.76,False,https://re.kufar.by/vi/1071257455,90.0,3,5,4.0,9.0,2018.0,23,27.610789,53.945279,"Логойский тракт, 17А, Минск",Елена,4.0,,70.0,2,11.0
1071248547,2026-06-02T08:21:53Z,Сдам квартиру с 17 июля,"Сдается однокомнатная квартира с 17 июля 2026 года со всеми удобствами (мебель,телевизора- 2, (на кухни и в зале), стиральная машина, микроволновка),",450.0,1290.06,False,https://re.kufar.by/vi/1071248547,43.0,2,1,4.0,5.0,,28,27.502165,53.848579,"Казинца ул, 78, Минск",Mancunians,2.0,135,,,
1071239421,2026-06-02T07:27:19Z,Квартира,"Отличная квартира , хорошее транспортное сообщение: метро, трамваи, троллейбусы, автобус",1200.0,3440.16,False,https://re.kufar.by/vi/1071239421,150.0,4,10,8.0,9.0,2004.0,23,27.595212,53.924946,"Сурганова ул, 27, Минск",Снежана,7.0,,60.0,3,60.0
1071192814,2026-06-02T07:23:49Z,сдам,сдам на длительный срок без животных,1100.0,3153.48,False,https://re.kufar.by/vi/1071192814,45.0,2,5,,,1979.0,30,27.486992,53.903477,"Одоевского ул, 40, Минск",Ирина,2.0,,19.0,1,7.0
1071192561,2026-06-02T07:23:45Z,Квартира,1мин. до метро. Полностью готова для проживания,500.0,1433.4,False,https://re.kufar.by/vi/1071192561,29.0,,,3.0,,,28,27.550297,53.868557,"Братская ул, 16, Минск",Марина,,170,,,
1071193778,2026-06-01T18:29:55Z,Аренда квартиры,Сдается в аренду однокомнатная квартира молодой паре,320.0,917.38,False,https://re.kufar.by/vi/1071193778,32.0,1,1,3.0,9.0,1975.0,26,27.683068,53.876027,"Ангарская ул, 60, Минск",Елена,,10,25.0,1,6.0
1062079390,2026-06-01T14:06:43Z,Сдаётся 1-комн.квартира в Зелёном луге,"Сдам 1-комн.квартиру на 2-3 недели или месяц, можно студентам на сессию
С 10-15 апреля
Квартира с хорошим ремонтом, есть двусп.кровать и односпальный",0.0,0.0,False,https://re.kufar.by/vi/1062079390,33.0,3,1,,,,24,27.629807,53.955887,"Тикоцкого ул, 18, Минск",Ирина,,100,,1,
1071138686,2026-06-01T10:18:44Z,Аренда квартир,"ЖК мечты "" Левада"": у реки и современного города. Квартира с дизайнерским ремонтом.

В уютном жилом комплексе с развитой инфраструктурой. С одной стор",1050.0,3010.14,False,https://re.kufar.by/vi/1071138686,50.0,3,10,3.0,7.0,2025.0,22,27.526554,53.942274,"Нововиленская ул, Минск",Юлия,2.0,,25.0,2,10.0
1071129100,2026-06-01T08:51:29Z,2-комнатная квартира в центра. Собственник. Метро 5 мин,"2-комнатная квартира в центре Минска (Собственник). Подходит для иностранных граждан.

Готова к заселению. Квартира светлая, просторная и полностью ме",750.0,2150.1,False,https://re.kufar.by/vi/1071129100,56.0,2,5,5.0,5.0,,29,27.55256,53.897727,"Независимости пр, 13, Минск",Елена,2.0,,33.0,3,7.0
1071128843,2026-06-01T08:49:45Z,"Сдам однокомнатную квартиру, Пионерская 9","Просторная уютная 1 комнатная квартира в престижном районе Дрозды - лучшее месторасположение в Минске.
В квартире все необходимое для проживания.
Аген",523.23,1500.0,False,https://re.kufar.by/vi/1071128843,48.0,2,5,2.0,,,22,27.488017,53.939688,"Пионерская ул, Минск",Людмила,,195,,,
1054407301,2026-06-01T08:42:14Z,"Аренда 3-комнатной квартиры, Дзержинского 24","Сдаётся на длительный срок просторная  светлая трёхкомнатная квартира.

Отличное транспортное сообщение, в двух минутах ходьбы станции метро ""Грушевка",1000.0,2866.8,True,https://re.kufar.by/vi/1054407301,101.0,4,,16.0,20.0,,29,27.517069,53.888268,"Дзержинского пр, 24, Минск",ООО Центр недвижимости ГАЛАКТИКА,,,63.2,4,14.1
1071124924,2026-06-01T08:17:54Z,Сдам квартиру,"Сдам 1-комнатную квартиру с 25-го июля 2026г.  Квартира в отличном состоянии, современная, чистая. Рядом находятся торговые центры, железнодорожный во",575.55,1650.0,False,https://re.kufar.by/vi/1071124924,43.1,1,5,10.0,10.0,2018.0,28,27.548662,53.885262,"Могилёвская ул, 24, Минск",Юлия,1.0,,17.8,2,10.4
1071124754,2026-06-01T08:16:01Z,Сдаётся 3-х комнатная квартира на длительный срок,Сдаю 3-х комнатную квартиру по адресу Сухаревская 46. 1 этаж. Ремонт от застройщика. На длительный срок. Оплата первый и последний месяц договора. Зак,523.23,1500.0,False,https://re.kufar.by/vi/1071124754,76.7,1,1,1.0,9.0,2009.0,30,27.426814,53.889279,"Сухаревская ул, 46, Минск",Надежда,3.0,265,,10,9.0
