ad_id,list_time,subject,body_short,price_usd,price_byn,company_ad,ad_link,area_total,balcony,condition,floor,floors_total,building_year,area_code,location_lon,location_lat,address,contact_name,rooms,district,area_living,building_type,area_kitchen
1074978660,2026-06-28T17:00:38Z,Сдаётся 1 комнатная квартира студия,"Сдается на длительный срок уютная квартира-студия 40,5 кв.м расположенная на 14 этаже с балконом и красивым видом.",491.23,1408.25,False,https://re.kufar.by/vi/1074978660,40.5,1,5,14.0,16.0,2008.0,27,27.571440815101063,53.84264108227925,"Игуменский тракт, 26, Минск",Елена,,145,28.1,10,
1074975158,2026-06-28T16:47:25Z,Аренда стильная однушка у метро.,"Сдается уютная, светлая, теплая студия (1-комн. квартира, общ. площадь 48 м.кв). Возле метро. Солнечная сторона (запад). Окна во двор (отсутствие шума",580.0,1662.74,False,https://re.kufar.by/vi/1074975158,48.0,1,10,4.0,13.0,2013.0,29,27.514966,53.885687,"Щорса ул, 11, Минск",Юлия,1.0,55,31.3,2,
1074963286,2026-06-28T14:57:09Z,Квартира аренда,Сдается уютная солнечная квартира на 25 этаже .Желательна долгосрочная аренда.Квартира свободна с 1-2 июля,650.0,1863.42,False,https://re.kufar.by/vi/1074963286,45.0,3,5,25.0,25.0,,28,27.527057,53.86852,"Брилевская ул, 37, Минск",Ирина Богдан,,170,,2,
1074960652,2026-06-28T14:20:08Z,две аккуратные девушки студентки ищут квартиру,"две аккуратные девушки студентки ищут недорогую квартиру. одна из РФ (требуется регистрация), вторая из РБ. въезд планируется в 20-х числах июля на до",418.59,1200.0,False,https://re.kufar.by/vi/1074960652,65.0,1,1,,,,30,27.453967695268148,53.906856526094266,"Лещинского ул, Минск",Елизавета,2.0,,50.0,,15.0
1074941228,2026-06-28T11:39:14Z,Сдается двухкомнатная квартира на Ангарской,"Сдается уютная, теплая 2-х комнатная квартирав Заводском районе Минска. 3 остановки от метро Могилевская. Рядом зеленая зона и вся инфраструктура. Воз",0.0,0.0,False,https://re.kufar.by/vi/1074941228,48.7,3,5,3.0,5.0,,26,27.685646,53.874641,"Ангарская ул, 52, Минск",Александр,2.0,10,31.9,4,7.5
1074929903,2026-06-28T09:46:56Z,Сдам квартиру,"Сдается квартира на длительный срок.
Есть вся необходимая мебель и техника
Для одного человека или пары, без животных
Собственник",450.0,1290.06,False,https://re.kufar.by/vi/1074929903,45.0,1,,,,,30,27.428047946559754,53.915849649071255,"Казимировская ул, 11, Минск",ghjk,2.0,105,18.0,,9.0
1074926168,2026-06-28T09:00:44Z,"Сдаётся в долгосрочную аренду светлая 3-х комнатная квартира, м. Кунцевщина.","Сдаётся в долгосрочную аренду светлая 3-х комнатная квартира 84 м2, с евроремонтом, рядом с м. Кунцевщина, красивый вид на парк, все необходимое для к",800.0,2293.44,False,https://re.kufar.by/vi/1074926168,84.0,3,5,2.0,9.0,2006.0,30,27.460941,53.906278,"Тимошенко ул, 8, Минск",Инна,4.0,,50.0,,10.6
1074925405,2026-06-28T08:53:01Z,Аренда квартиры в центре на Азгура 1А,"Собственник. 15 минут пешком от ст.метро Площадь Победы.
В квартире современный ремонт, есть всё необходимое для жизни (холодильник, посудомойка, элек",900.0,2580.12,False,https://re.kufar.by/vi/1074925405,86.0,4,,6.0,,,25,27.581226,53.901382,"Азгура ул, 1А, Минск",Антон,2.0,200,,,
1074919139,2026-06-28T07:36:05Z,Однокомнатная квартира для долгосрочной аренды,"Сдается однокомнатная квартира для проживания одного человека без животных и вредных привычек
Хорошее транспортное сообщение 
Рядом 10 минут ходьбы ме",380.0,1089.38,False,https://re.kufar.by/vi/1074919139,33.7,3,1,4.0,10.0,1982.0,29,27.473985,53.863497,"Голубева ул, 13, Минск",Пользователь,1.0,320,,2,7.0
1070309031,2026-06-27T18:33:16Z,Сдается с 01.09.2026 уютная однокомнатная квартира 45 метров недалеко от станции метро Спортивная,Сдается с 01.09.2026 однокомнатная уютная квартира от собственника (прописан один человек) недалеко от станции метро «Спортивная» по договору на длите,480.0,1376.06,False,https://re.kufar.by/vi/1070309031,45.0,3,10,7.0,17.0,2012.0,30,27.475665,53.895546,"Пономаренко ул, 58, Минск",Оксана,3.0,,18.0,10,9.5
1074867864,2026-06-27T17:57:09Z,Просторная и очень уютная 3к квартира на Игуменском тракте (Лошица) - Без комиссии,"Сдается большая, очень теплая и полностью укомплектованная 3-комнатная квартира (67 кв.м.) на длительный срок.
Квартира очень уютная, чистая, готовая",610.44,1750.0,False,https://re.kufar.by/vi/1074867864,67.0,1,1,6.0,10.0,2004.0,27,27.572539,53.84255,"Игуменский тракт, Минск",Анна,5.0,145,,1,9.0
1074865241,2026-06-27T17:13:49Z,Сдается 3-комнатная квартира в центре,"Сдается 3-комнатная квартира от собственника в самом центре Минска.

Адрес: пр. Победителей, 43-1. Дом находится прямо напротив стелы «Минск город-гер",872.05,2500.0,True,https://re.kufar.by/vi/1074865241,65.0,1,5,9.0,9.0,,22,27.535448,53.915427,"Победителей пр, 43/1, Минск",ИП Романенко Александр Степанович,2.0,,65.0,,
1074855202,2026-06-27T16:01:14Z,Аренда квартиры-студии с 27.07,"Сдается с 27.07. С животными не сдаем. 
Длительная аренда. Квартира-студия. Дизайнерский ремонт, встроенная техника, полностью мебелированная квартира",550.0,1576.74,False,https://re.kufar.by/vi/1074855202,60.0,3,10,9.0,9.0,,30,27.476949,53.901371,"Одоевского ул, 115А, Минск",Анна Понамарева,2.0,,23.0,2,13.0
1048383219,2026-06-27T14:54:08Z,"Квартира, 2 комн., 50 м², этаж 7 из 16","Квартира сдается на длительный срок, без домашних животных. 
Оборудована мебелью и бытовой техникой. Ремонт новый. 
Отличное расположение дома- в шаго",970.0,2780.8,False,https://re.kufar.by/vi/1048383219,50.0,1,5,7.0,16.0,2012.0,22,27.539912,53.911556,"Победителей пр, 27, Минск",Анна,2.0,90,13.0,,
1074846796,2026-06-27T14:12:08Z,Сдается 1 комнатная квартира,"Сдается 1 комнатная квартира на ул. Чюрлёниса, 24, возле метро ""Малиновка"" на длительный срок. Никто не прописан. Договор аренды . Предоплата за 1 мес",460.0,1318.73,False,https://re.kufar.by/vi/1074846796,41.0,3,,10.0,,,29,27.484872,53.854268,"Чюрлёниса ул, 24, Минск",Светлана,,,,,
1074844699,2026-06-27T13:41:47Z,Сдам квартиру на длительный срок,"Просмотр квартиры не ранее 10.07

Сдам квартиру на длительный срок с заключением договора.
Гражданам РБ, желательно работающей девушке
В квартире: меб",350.0,1003.38,False,https://re.kufar.by/vi/1074844699,31.0,3,,3.0,,,28,27.551716,53.868589,"Братская ул, 12, Минск",Алина,,170,,,
1074843054,2026-06-27T13:22:19Z,сдается в аренду 2-комнатная квартира,"Сдается 2-комнатная просторная квартира на длительный срок, 7 минут до метро Грушевка, 
одна остановка до метро Институт культуры.
Арендная плата - +",590.0,1691.41,False,https://re.kufar.by/vi/1074843054,68.5,3,5,11.0,19.0,2013.0,29,27.521847,53.883304,"Разинская ул, 62, Минск",Алла,2.0,55,61.1,1,12.0
1028892555,2026-06-27T13:05:48Z,Квартира двухкомнатная,"————————

Актуально с 23 августа. 
Сдается на месяц, два, три. 
Более длительный срок оговаривается индивидуально.
——————-
Шикарная новая квартира 58",1100.0,3153.48,False,https://re.kufar.by/vi/1028892555,62.0,1,10,14.0,17.0,2023.0,29,27.48754,53.867166,"Дзержинского пр, 90, Минск",Inna,,,,,
1062948899,2026-06-27T12:51:43Z,"уже скоро -  2к.кв, ''На Грушевке'', длгср аренда, первое заселение","Граждане Китая могут оплачивать юанями через вичат или алипей.

Открыт предзаказ на аренду 2ух комнатной квартиры.  

При 100 процентной предоплате, в",800.0,2293.44,False,https://re.kufar.by/vi/1062948899,44.0,3,10,5.0,19.0,2025.0,29,27.51131,53.886323,"Дзержинского пр, 32, Минск",Алексей Александрович Полещук,2.0,,40.0,10,11.0
1074836028,2026-06-27T12:35:12Z,однокомнатная квартира возле метро,"Продается однокомнатная квартира в ЖК ""Минск-Мир"" Дом «Вена».
Площадь по СНБ 33.5 м2. Дом 2023 года постройки. Видеонаблюдение 24/7. 

Развитая уже ин",600.0,1720.08,False,https://re.kufar.by/vi/1074836028,33.5,4,5,9.0,19.0,2022.0,28,27.544664,53.868578,"Николы Теслы ул, 18, Минск",Жанна,2.0,170,29.5,10,5.0
1074835815,2026-06-27T12:33:23Z,Трёхкомнатная квартира в ЖК Vogue,"С 1 сентября 2026 года !!!
Квартира в новом элитном ЖК Vogue.
Просторная ,есть все необходимое,3 комнаты-94 метра.2 изолированные комнаты и гостиная с",900.0,2580.12,False,https://re.kufar.by/vi/1074835815,94.0,3,1,5.0,16.0,2018.0,24,27.62556137452631,53.922678061221895,"Макаёнка ул, 12Б, Минск",Ася,6.0,,70.0,2,20.0
1074826714,2026-06-27T11:22:24Z,Сдам в аренду квартиру,Из из мебели только кухня и шкаф-купе,0.0,0.0,False,https://re.kufar.by/vi/1074826714,33.0,,,4.0,5.0,,30,27.483857,53.900278,"Бельского ул, 31, Минск",Иван,,290,18.0,1,7.0
1074824775,2026-06-27T11:03:14Z,Квартира,"Сдам в аренду на длительный срок квартиру евро решку. Хорошее транспортное сообщение , рядом метро, торговый центр",680.0,1949.42,False,https://re.kufar.by/vi/1074824775,56.0,3,5,15.0,25.0,2022.0,28,27.5371,53.868754,"Игоря Лученка ул, 8, Минск",Оксана,5.0,170,25.0,2,20.0
1074821185,2026-06-27T10:40:56Z,Недвижимость,"Шикарная квартира возле парка Горького , сдается 1-2 месяца",2500.0,7167.0,False,https://re.kufar.by/vi/1074821185,176.0,4,10,3.0,4.0,1958.0,25,27.579851,53.90561,"Захарова ул, 27, Минск",Елена,5.0,,100.0,3,15.0
1074819197,2026-06-27T09:55:21Z,Аренда квартиры,"Квартира двухкомнатная, комнаты не проходные.
Окна выходят на две стороны. 
Рядом большая детская площадка и парковка.
Метро восток и Дана Молл в 5 ми",600.0,1720.08,False,https://re.kufar.by/vi/1074819197,48.6,3,1,2.0,9.0,,24,27.642814,53.934557,"Независимости пр, 127, Минск",Самира М,2.0,45,30.73,1,7.07
1069753830,2026-06-27T08:58:16Z,Сдать на длительный срок 2к квартиру,Сдается вперые на длительный срок предпочтительно порядочной без вредных привычек паре комфортабельная полностью укомплектованная квартира с дизайнерс,1000.0,2866.8,False,https://re.kufar.by/vi/1069753830,77.0,4,10,2.0,3.0,2014.0,24,27.606178727507828,53.928011672190124,"Кузьмы Чорного ул, 25, Минск",Наталья,2.0,,39.0,10,12.0
1074181348,2026-06-27T08:37:24Z,Сдача квартиры,"Метро в шаговой доступности (7 минут) , универмаг Беларусь, рядом поликлиника и детский сад , магазин Евроопт, кинотеатр.",436.03,1250.0,False,https://re.kufar.by/vi/1074181348,30.0,2,1,2.0,5.0,1965.0,26,27.631145,53.869067,"Филатова ул, 15, Минск",Марина,2.0,,19.5,3,6.2
1074811166,2026-06-27T08:12:39Z,Сдам однокомнатную квартиру на длительный срок,"Сдам на длительный срок однокомнатную ухоженную кваптиру, тихий центр, есть все для проживания. Без животных.Договор. В квартире никто не прописан. +",400.0,1146.72,False,https://re.kufar.by/vi/1074811166,34.0,1,1,3.0,5.0,1969.0,22,27.547413,53.925852,"Осипенко ул, 4, Минск",Игорь,2.0,,187.0,3,7.0
1074806870,2026-06-27T07:51:44Z,"Аренда 3-комнатной квартиры, Мстиславца 22","Трёхкомнатная квартира по адресу: Мстиславца 22
Ремонт выполнен из качественных материалов, квартира  укомплектована всей необходимой мебелью и техник",700.0,2006.76,True,https://re.kufar.by/vi/1074806870,76.1,3,,7.0,11.0,2014.0,24,27.653164,53.932972,"Петра Мстиславца ул, 22, Минск",ООО Центр недвижимости ГАЛАКТИКА,,325,68.9,4,
1074806872,2026-06-27T07:51:44Z,"Аренда 1-комнатной квартиры, Мулявина 3","Работаем по факту!

1-комнатная квартира в историческом центре города в доме 1964 года постройки. Квартира полностью укомплектована всей необходимой м",500.0,1433.4,True,https://re.kufar.by/vi/1074806872,30.37,,,5.0,5.0,1964.0,23,27.585484,53.914841,"Мулявина бул, 3, Минск",ООО Центр недвижимости ГАЛАКТИКА,,,20.27,1,5.23
1062882780,2026-06-27T07:25:07Z,Сдаю квартиру на время сессии. Отпуска.,"Сдаю квартиру студентам. Стоимость 1550 руб.
Квартира свободна с 10 сентября.
Командировочным, гостям столицы. Курить в квартире нельзя.
Компаниям не",540.67,1550.0,True,https://re.kufar.by/vi/1062882780,29.0,3,5,4.0,22.0,2018.0,28,27.551788,53.868727,"Братская ул, 12, Минск",АА0871288,2.0,170,,2,
216017094,2026-06-27T07:22:11Z,СДАЮ квартиру на время сессии с 13 июля,"Квартира свободна с 10 сентября.
Компаниям не сдаю.
Сдаю квартиру заочникам,  командировочным,на время сессии, повышение квалификации, гостям столицы.",540.67,1550.0,False,https://re.kufar.by/vi/216017094,30.0,3,5,4.0,22.0,2021.0,28,27.551806,53.868722,"Братская ул, 12, Минск",Светлана,2.0,170,,2,
1074781147,2026-06-27T04:24:41Z,Аренда квартиры пр-т Победителей,"Сдаётся уютная и светлая квартира в долгосрочную аренду. Пространство с удобной планировкой, подходящее для комфортного проживания. В квартире есть вс",750.0,2150.1,False,https://re.kufar.by/vi/1074781147,60.0,1,10,2.0,,,22,27.477804664259935,53.93572896008037,"Победителей пр, 115, Минск",Елизавета,1.0,,,,
1074778567,2026-06-27T04:01:34Z,Аренда 1 комн. квартиры,"Аренда 1 комн. квартиры
 
Сдается современная, просторная 1-к квартира на длительный срок в самом чистом и престижном районе Минска. Квартира располож",600.0,1720.08,False,https://re.kufar.by/vi/1074778567,43.0,3,5,11.0,11.0,,22,27.467944068786068,53.94017212557605,"Победителей пр, 127, Минск",Елена,,,18.5,,10.0
1074778109,2026-06-26T21:04:54Z,Сдам квартиру на долгий срок с мебелью,"Сдам однокомнатную квартиру на длительный срок в прекрасном месте : напротив дома- парк Павлова, недалеко от метро. Квартира благоустроена всей необхо",500.0,1433.4,False,https://re.kufar.by/vi/1074778109,40.0,1,1,7.0,9.0,2014.0,29,27.461696,53.853492,"Космонавтов ул, 10, Минск",Ольга,4.0,,,1,
1074773868,2026-06-26T19:35:03Z,Сдам 3-комнатную квартиру с гардеробной и двойным балконом,"Сдается просторная 3-комнатная квартира рядом с парком Павлова (Минск)
   /месяц
Московский район, Минск
   65 м² | 9 этаж
  Долгосрочная аренда (от 1",750.0,2150.1,False,https://re.kufar.by/vi/1074773868,65.0,1,10,9.0,9.0,,29,27.469098,53.857359,"Белецкого ул, 2, Минск",Марина,4.0,320,,1,
1074754380,2026-06-26T15:59:34Z,1 комната  квартира по проспекту  Рокоссовского д.71,Сдаётся  1 комната  квартира  по проспекту Рокоссовского д.71.,418.59,1200.0,False,https://re.kufar.by/vi/1074754380,60.0,,1,1.0,5.0,,27,27.606592946384467,53.86597602733014,"Рокоссовского пр, 71, Минск",Татьяна,2.0,230,,1,
1072602505,2026-06-26T15:57:22Z,Современная 2-комнатная квартира возле ст.м. Уручье,"Современная 2-комнатная квартира по пр-ту Независимости, 168к3 возле станции метро “Уручье”.
Квартира полностью меблирована и оснащена всей необходимо",730.0,2092.76,False,https://re.kufar.by/vi/1072602505,57.1,2,10,12.0,12.0,,24,27.693326,53.945841,"Независимости пр, 168к3, Минск",Алексей,2.0,280,40.0,10,12.0
1074754638,2026-06-26T15:56:25Z,Сдам квартиру на длительный срок,"Сдам квартиру 
 Минске 
 Октябрьский район",313.94,900.0,False,https://re.kufar.by/vi/1074754638,30.0,2,22,3.0,,,28,27.558633,53.883612,"Артиллеристов ул, Минск",Наталья,1.0,,18.0,1,6.0
1074754105,2026-06-26T15:47:10Z,"Аренда 3 кв. по ул.В.Хоружей,д.21","Сдается просторная 3-комнатная квартира 68 кв.м. по ул. В.Хоружей, 21, в самом центре города - рядом Комаровский рынок.

Квартира готова к заселению.",800.0,2293.44,True,https://re.kufar.by/vi/1074754105,68.77,3,,3.0,9.0,1973.0,23,27.568775,53.920727,"Веры Хоружей ул, 21, Минск",Агентство недвижимости Юриэлт в Минске,,120,46.8,3,6.83
1074749313,2026-06-26T14:49:18Z,Квартира в знаменитом доме на Кульман возле Комаровки,"Редкое предложение. Поторопитесь.

Сдается на длительный период просторная 1к квартира в доме на Кульман,13

Напротив Комаровского рынка. В тихих двор",540.67,1550.0,True,https://re.kufar.by/vi/1074749313,38.5,3,5,6.0,9.0,1982.0,23,27.576105,53.922475,"Кульман ул, 13, Минск",ОДО Старый Стиль,,120,17.5,3,10.2
1074744878,2026-06-26T13:39:18Z,Квартира,"Квартира с хорошим ремонтом в центре города,две линии метро, парк им.Горького, набережная реки Свислочь в шаговой доступности гимназия,школы,сады, бан",593.0,1700.0,False,https://re.kufar.by/vi/1074744878,38.0,1,5,,2.0,1976.0,25,27.583292,53.898384,"Захарова ул, 56, Минск",Татьяна,2.0,200,21.7,3,11.0
1074742851,2026-06-26T13:31:10Z,"Сдам квартиру, Минск","Сдается светлая, уютная квартира у м. «Кунцевщина» на длительный срок. 

Преимущества расположения:
Метро: всего 1 минута ходьбы до станции «Кунцевщин",571.19,1637.5,False,https://re.kufar.by/vi/1074742851,42.0,,5,4.0,16.0,2014.0,30,27.457941,53.905307,"Притыцкого ул, 77, Минск",Vita,,80,,2,
1074737535,2026-06-26T12:54:35Z,"Аренда 2-комнатной квартиры, Сторожовская 6",Предлагается в долгосрочную аренду двухкомнатная квартира в престижном доме с закрытой охраняемой территорией и видеонаблюдением. Дом расположен в сам,950.0,2723.46,True,https://re.kufar.by/vi/1074737535,53.9,4,,3.0,24.0,2011.0,22,27.556835,53.910324,"Сторожовская ул, 6, Минск",ООО Центр недвижимости ГАЛАКТИКА,,260,45.1,4,
1074735690,2026-06-26T12:37:15Z,Сдается однокомнатная квартира 48 кВ Слободская.,"Сдается однокомнатная квартира в малиновке, в идеальном состоянии после ремонта. От метро 2 остановки, пешком 15 мин. На длительный срок. Вся техника",600.0,1720.08,False,https://re.kufar.by/vi/1074735690,48.0,4,5,17.0,19.0,2013.0,29,27.452533,53.845928,"Слободская ул, 125, Минск",Яна,2.0,150,22.0,2,16.0
1074734983,2026-06-26T12:31:07Z,"Уютная 1-комнатная квартира по ул. Орловская, 31/2","Сдается светлая и уютная однокомнатная квартира по адресу ул. Орловская, 31/2 — в одном из самых комфортных и зеленых районов Минска. Отличный вариант",400.0,1146.72,False,https://re.kufar.by/vi/1074734983,33.0,3,1,4.0,5.0,,22,27.55295889740261,53.93120258859664,"Орловская ул, 31/2, Минск",Алеся,1.0,,,3,
1073823335,2026-06-26T12:23:58Z,Стильная квартира с машиноместом в ЖК 'Лазурит',"Красивая и стильная двухкомнатная квартира, с дизайнерским ремонтом и превосходным видом на проспект и водохранилище для качественной и комфортной жиз",1200.0,3440.16,True,https://re.kufar.by/vi/1073823335,61.0,3,10,16.0,30.0,,22,27.477219,53.936757,"Победителей пр, 115, Минск",ООО ''АН Клевер'',2.0,,43.6,,
1074711764,2026-06-26T09:01:56Z,"квартира 2 комнаты, 73м2 2c/у, шлагбаум, консьерж","светлая просторная квартира на длительный срок - 2 комнаты, 73 м2, 2 санузла, шлагбаумы, консьерж

2 жилых теплых эксплуатируемых балкона.

Квартира п",680.0,1949.42,False,https://re.kufar.by/vi/1074711764,73.0,3,10,12.0,17.0,2009.0,29,27.48392,53.872985,"Алибегова ул, 12, Минск",Денис,4.0,320,50.0,10,10.0
