ad_id,list_time,subject,body_short,price_usd,price_byn,company_ad,ad_link,area_total,balcony,condition,floor,floors_total,building_year,area_code,location_lon,location_lat,address,contact_name,rooms,district,area_living,building_type,area_kitchen
1075986138,2026-07-06T08:14:22Z,1-комнатная квартира на длительный срок сдаю,на длительный срок с мебелью и всей техникой. В КВАРТИРЕ НИКТО НЕ ПРОПИСАН.,350.0,1003.38,False,https://re.kufar.by/vi/1075986138,43.0,1,1,1.0,10.0,2000.0,25,27.633265,53.908692,"Филимонова ул, 8, Минск",Сергей,2.0,240,18.0,,9.0
1072574997,2026-07-06T08:08:50Z,1-комнатная квартира на ст.м Петровщина на длительный срок,1-комнатная квартира от собственника только на длительный срок (договор). Ст. м. «Петровщина» - в шаговой доступности. Можно иностранцам. Дети приветс,600.0,1720.08,False,https://re.kufar.by/vi/1072574997,39.3,3,5,2.0,25.0,2014.0,29,27.483812,53.865717,"Газеты Правда пр, 17, Минск",Оксана,,320,17.9,2,10.0
1075985505,2026-07-06T08:07:07Z,Сдается однокомнатная квартира,"Сдам уютную однокомнатную квартиру в центре города на длительный срок. Прекрасное месторасположение. Рядом: метро, парки, озеро, магазины и многое дру",500.0,1433.4,False,https://re.kufar.by/vi/1075985505,40.0,1,5,9.0,19.0,1992.0,22,27.53419,53.911291,"Заславская ул, 27, Минск",Никита,3.0,90,37.0,3,
1075888205,2026-07-06T08:00:01Z,Сдается однокомнатная квартира на 2 месяца,Сдается с 6 июля однокомнатная квартира в центре города ( 2 мин.  до Комаровского рынка) сроком на ДВА МЕСЯЦА.Аккуратной некурящей ДЕВУШКЕ/ДАМЕ.Без жи,453.47,1300.0,False,https://re.kufar.by/vi/1075888205,30.0,2,,2.0,,,23,27.570202289523735,53.92039825190612,"Веры Хоружей ул, 19, Минск",Алена,1.0,120,23.0,3,6.0
1075983659,2026-07-06T07:51:10Z,"Аренда 1-комнатной квартиры, Братская 9","Уютная однокомнатная квартира с дизайнерским ремонтом!
Квартира уже готова к проживанию и полностью укомплектована всем необходимым! Установлена новая",590.0,1691.41,True,https://re.kufar.by/vi/1075983659,32.5,3,,5.0,10.0,2024.0,28,27.549498,53.864765,"Братская ул, 9, Минск",ООО Центр недвижимости ГАЛАКТИКА,,170,28.4,10,
1073579249,2026-07-06T07:47:01Z,Сдается однокомнатная квартира возле метро,"Сдается однокомнатная квартира на длительный срок аренды по договору найма ,в квартире есть все необходимое для жизни 
Рядом метро ковальская слобода",350.0,1003.38,True,https://re.kufar.by/vi/1073579249,38.0,1,1,,12.0,,28,27.551132,53.879769,"Жуковского ул, 17, Минск",ООО Атлас недвижимости,2.0,,16.0,,
1063504377,2026-07-06T07:44:53Z,1-Квартира в ЖК «Северный Берег»,"В долгосрочную аренду сдается новая квартира в ЖК «Северный Берег», «тихий» дом Parkland4, вторая береговая линия. 

На первом этаже дома находится Кл",850.0,2436.78,False,https://re.kufar.by/vi/1063504377,43.0,1,,3.0,7.0,2024.0,23,27.56829,53.962049,"Виталия Цвирко ул, 74, Минск",Ольга,,,,,
1075982958,2026-07-06T07:41:42Z,Сдаю квартиру,"Сдаю квартиру на длительный срок ,полностью готова к проживанию со всей мебелью и техникой ,официальное оформление",488.35,1400.0,False,https://re.kufar.by/vi/1075982958,29.8,1,5,5.0,16.0,2023.0,28,27.541574,53.863487,"Михаила Савицкого ул, Минск",Юлия,2.0,170,,,
1067718252,2026-07-06T07:26:24Z,Сдаётся 3-х комнатная квартира в районе Комаровского рынка,"Квартира в самом центре города, в пешей доступности станция метро Я. Коласа, Советский район, Комаровский рынок.

 В квартире сделан хороший ремонт, 2",593.0,1700.0,True,https://re.kufar.by/vi/1067718252,71.1,3,1,8.0,9.0,1970.0,23,27.570347,53.920359,"Веры Хоружей ул, 19, Минск",ООО Максимум Недвижимость,,120,48.2,3,7.1
1074343915,2026-07-06T07:12:57Z,Долгосрочная аренда 3к,Сдается на длительный срок (от года)  трёхкомнатная квартира в районе пл. Бангалор Имеется основная мебель и техника. В 2 минутах ходьбы от остановок,600.0,1720.08,False,https://re.kufar.by/vi/1074343915,70.0,1,5,7.0,13.0,2000.0,23,27.581073,53.934281,"Максима Богдановича ул, 114, Минск",Дарья,4.0,,38.0,3,9.0
1075977419,2026-07-06T07:05:02Z,Квартира,"Квартира студия с отдельной спальной комнатой. Качественный,современный ремонт, новая мебель и бытовая техника. Можно с любимым питомцом.",680.0,1949.42,False,https://re.kufar.by/vi/1075977419,45.0,,,,,,22,27.530255,53.937244,"Нововиленская ул, 53, Минск",алеся,,,27.0,,
1072610480,2026-07-06T07:04:56Z,Просторная 2-комнатная квартира (49 м²),"Первая аренда.
Сдам просторную 2-комнатную квартиру (49 м²) на длительный срок по договору аренды. 
Адрес: ул. Щорса, 4А - 5 минут до метро Грушевка.",700.0,2006.76,False,https://re.kufar.by/vi/1072610480,49.0,3,10,11.0,18.0,2019.0,29,27.52023,53.88238,"Щорса ул, 4А, Минск",Леонид,4.0,55,47.0,2,
1075406498,2026-07-06T07:00:50Z,"Сдаётся однокомнатная квартира,Алтайская ул, 90к1","Первое заселение после косметического ремонта.

 Чистая,светлая однокомнатная квартира только  в долгосрочную аренду 
(на длительный срок!!)

  Уборка",400.0,1146.72,True,https://re.kufar.by/vi/1075406498,34.0,3,1,7.0,9.0,,26,27.670473,53.871355,"Алтайская ул, 90к1, Минск",ООО Альфа-риэлт,1.0,215,17.0,,7.2
1075977063,2026-07-06T06:58:42Z,"Сдается 3-комн квартира Минск, Чехова,3","Сдаётся уютная просторная и светлая 3-комнатная квартира в престижном районе, вблизи центра г.Минска.
Полностью меблирована и оснащена всей необходимо",800.0,2293.44,False,https://re.kufar.by/vi/1075977063,100.0,1,,8.0,8.0,,22,27.529456,53.914266,"Чехова ул, 3, Минск",Игорь,3.0,,,,
1074197608,2026-07-06T06:49:35Z,"2-я квартира в ЖК ''Минск Мир'' по адресу Белградская,9","Сдается хорошая, уютная квартира на долгосрочный период.

 ""Евро двушка""

При заселении залог за имущество в размере ежемесячного платежа (возвращаетс",575.0,1648.41,True,https://re.kufar.by/vi/1074197608,38.0,,10,5.0,,,28,27.537792,53.864315,"Белградская ул, 9, Минск",ООО Альфа-риэлт,2.0,170,,,
1075147486,2026-07-06T06:49:16Z,"1 ком квартира Рафиева, 98","1 ком квартира в Малиновке ул. Рафиева, 98. Квартира чистая и уютная. Лоджия на кухне. Вся необходимая бытовая техника, мебель. На длительный срок. Пр",400.0,1146.72,True,https://re.kufar.by/vi/1075147486,38.0,3,1,,,,29,27.432528,53.857374,"Рафиева ул, 98, Минск",ООО Альфа-риэлт,,150,,,
1073211418,2026-07-06T06:44:22Z,1 комнатная квартира по ул.Притыцкого дом  2. Метро пушкинская,На длительный срок сдается 1 комнатная квартира по ул. Притыцого 2. Метро Пушкинская рядом. Квартира находится на 16 этаже. Для проживания есть крупна,500.0,1433.4,True,https://re.kufar.by/vi/1073211418,39.0,3,1,,,,30,27.506055,53.910585,"Притыцкого ул, 2, Минск",ООО Альфа-риэлт,,205,16.0,,9.5
1075975104,2026-07-06T06:40:26Z,Сдаётся двухкомнатная квартира срочно на летний период,Сдаётся квартира на лето,523.23,1500.0,False,https://re.kufar.by/vi/1075975104,65.0,,,,,,22,27.498284,53.930359,"Леси Украинки ул, 12к1, Минск",Дарья,2.0,40,,,
1071773074,2026-07-06T06:39:52Z,"4 ком квартира ул. Ржавецкая, 3 м-н Лебяжий","Аккуратная квартира в современном микрорайоне Лебяжий. Три изолированные спальни, гостиная совмещена с кухонной зоной. Два санузла. На длительный срок",767.41,2200.0,True,https://re.kufar.by/vi/1071773074,87.0,3,10,13.0,19.0,2014.0,22,27.462334,53.936211,"Ржавецкая ул, 3, Минск",ООО Альфа-риэлт,,210,51.0,,11.0
1075972532,2026-07-06T05:57:45Z,Сдаю 2-х комнатную квартиру,"Сдам жилье с 10.08.2026 года.Я,собственник.Никаких посредников.Лица не славянской внешности-огромная просьба не беспокоить.Район Тракторного завода.По",450.0,1290.06,False,https://re.kufar.by/vi/1075972532,43.0,1,1,2.0,4.0,,25,27.607717,53.883357,"Щербакова ул, 5, Минск",Сергей,3.0,,,3,5.5
1072602723,2026-07-06T05:45:27Z,Квартира,"Квартира расположена в красивом месте, рядом парк Челюскинцев, ботанический сад, торговый центр Дана Молл, 600-800 м, станция метро Московская, окна в",575.55,1650.0,False,https://re.kufar.by/vi/1072602723,54.0,3,5,5.0,10.0,1995.0,24,27.637119,53.920444,"Филимонова ул, Минск",Лариса,2.0,,28.0,3,10.0
1075944737,2026-07-06T04:52:24Z,Аренда 3-к квартиры в Зеленом луге,"Сдается светлая 3-к. квартира на длительный срок, Зеленый Луг

Локация: микрорайон Зеленый Луг (Минск). Тихий, зеленый район с развитой инфраструктуро",620.0,1777.42,False,https://re.kufar.by/vi/1075944737,60.0,1,1,8.0,9.0,,23,27.621021,53.95798,"Логойский тракт, 37/1, Минск",Юлия,5.0,100,40.0,1,8.0
1075944343,2026-07-06T04:45:19Z,"Квартира, 1 комн., 51 м², этаж 6 из 13","Сдаётся 1‑комнатная квартира в ЖК «Каскад», Минск (от собственника)
Площадь: 51 м²
Планировка: отдельная спальня, кухня‑гостиная, коридор, ванная, бал",523.23,1500.0,False,https://re.kufar.by/vi/1075944343,51.0,1,,6.0,13.0,2012.0,30,27.519736,53.910113,"Скрыганова ул, 4Б, Минск",Алеся,2.0,110,,10,
1075942473,2026-07-06T04:15:21Z,"Первая сдача Дизайнерский ремонт, все новое, 2-ая квартира, ул. Сурганова","Сдается впервые после капитального дизайнерского ремонта полноценная 2-комнатная квартира в тихом центре Минска на улице Сурганова.

Первая сдача. В к",700.0,2006.76,False,https://re.kufar.by/vi/1075942473,48.0,3,5,5.0,5.0,1973.0,23,27.592113,53.926632,"Сурганова ул, Минск",Татьяна,4.0,,30.03,3,6.63
1075941754,2026-07-06T04:02:34Z,Сдается 3х комнатная квартира р-н Академии Наук,"3х комнатная квартира, комнаты раздельные, санузел раздельный, высокие потолки, 2 балкона",523.23,1500.0,False,https://re.kufar.by/vi/1075941754,73.0,4,1,2.0,4.0,1950.0,24,27.598779,53.927968,"Чернышевского ул, 12, Минск",Ирина,3.0,,48.0,3,8.4
1075941307,2026-07-06T04:02:21Z,3х комнатная квартира,"Большая квартира, с гардеробной и двумя сан.узлами. Уютный закрытый двор, шлагбаум, хорошая детская площадка. 7- 10 минут шагом до метро Уручская.",650.0,1863.42,False,https://re.kufar.by/vi/1075941307,97.0,1,,9.0,10.0,,24,27.696417,53.951283,"Уручская ул, 6А, Минск",Анна,,50,,,
1075940079,2026-07-06T04:02:04Z,Квартиры в аренду,"Квартира сдаётся на длительный срок, не менее 1го года. Состояние - ухоженная, все аккуратно, все необходимое для проживания есть. Сдаётся взрослым  л",331.38,950.0,False,https://re.kufar.by/vi/1075940079,43.0,1,1,4.0,5.0,1972.0,26,27.63360023583689,53.83795241085737,"Голодеда ул, 27, Минск",Tamara,,,17.2,1,6.0
1075935008,2026-07-05T20:41:02Z,Аренда 3-х комнатной квартиры,"С 8 июля сдаётся 3-комнатная квартира. В квартире есть всё необходимое для комфортного проживания: оборудованная кухня с посудомоечной машиной, просто",593.0,1700.0,False,https://re.kufar.by/vi/1075935008,64.0,1,1,11.0,,1996.0,29,27.459684,53.848691,"Сергея Есенина ул, 19, Минск",Екатерина,,150,45.0,1,9.0
1075939893,2026-07-05T20:21:23Z,Сдам 2к квартиру пр. Пушкина,"ТОЛЬКО АККУРАТНОЙ СЕМЬЕ
БЕЗ ИСКЛЮЧЕНИЙ
(можно с маленькой собачкой, если вы несёте полную финансовую ответственность за повреждения)
.
Уютная, светлая",500.0,1433.4,False,https://re.kufar.by/vi/1075939893,50.2,1,,7.0,,,30,27.500988,53.923085,"Пушкина пр, 85, Минск",Настя,4.0,160,,,8.5
1073269682,2026-07-05T20:06:43Z,Сдаю двухкомнатную квартиру,"Сдается двухкомнатная квартира от собственника, на длительный срок. 
Девушкам (молодым специалистам),
аккуратным, без вредных привычек.",450.0,1290.06,False,https://re.kufar.by/vi/1073269682,51.0,3,1,1.0,12.0,2000.0,29,27.433363,53.861973,"Рафиева ул, 84, Минск",Вера,2.0,150,30.0,1,9.0
1075056572,2026-07-05T19:30:29Z,Сдам трёшку в Минске на длительный срок,"Сдаётся уютная трёхкомнатная квартира в 5 минутах езды от станции метро Академия Наук, прямой транспорт также ходит в течении 15 минут от станции метр",880.0,2522.78,False,https://re.kufar.by/vi/1075056572,104.1,4,1,4.0,,,25,27.628935,53.909365,"Авангардная ул, 46, Минск",Петя,4.0,240,,3,
1075058570,2026-07-05T19:30:18Z,Двухкомнатная квартира на длительный срок,Сдам двухкомнатная квартиру на длительный срок,800.0,2293.44,False,https://re.kufar.by/vi/1075058570,42.1,1,1,5.0,,,24,27.610178,53.937234,"Волгоградская ул, 55, Минск",Петя,3.0,,,1,
1070402013,2026-07-05T19:09:21Z,Квартира в центре Минска,"Квартира в прекрасном состоянии, после ремонта.Оснащена всем необходимым для комфортного проживания. В шаговой доступности станция метро. Долгосрочная",600.0,1720.08,False,https://re.kufar.by/vi/1070402013,31.0,1,5,5.0,5.0,,25,27.575476873344122,53.89965602320178,"Пулихова ул, 3, Минск",Евгений,,200,,,
1075934499,2026-07-05T18:52:22Z,Роскошная 2-комнатная квартира в сердце столицы,"Роскошная двухкомнатная квартира для тех кто любит жизнь и ценит своё здоровье.
Достоинства квартиры: 
- расположена в самом сердце города 50 м от ТЦ",530.0,1519.4,False,https://re.kufar.by/vi/1075934499,51.0,3,5,9.0,9.0,1996.0,22,27.54595171941563,53.90814633249825,"Обойная ул, 4к2, Минск",Алексей,,90,35.0,3,9.0
1075934014,2026-07-05T18:45:41Z,Аренда квартиры,Квартира с отличным евроремонтом. 15 минут пешком до станции метро Спортивная.,600.0,1720.08,False,https://re.kufar.by/vi/1075934014,40.0,3,5,7.0,10.0,2010.0,30,27.47488325102318,53.8993022748003,"Киреенко ул, 5, Минск",Юрий,2.0,,17.0,1,10.0
1075932608,2026-07-05T18:37:17Z,Аренда квартиры,"Трёхкомнатная квартира 82кв. Две изолированные комнаты. Большая гостиная совмещённая с кухней , большие раздельные санузлы. Квартира полностью укомпле",800.0,2293.44,True,https://re.kufar.by/vi/1075932608,82.0,1,10,8.0,10.0,2013.0,30,27.45764853216003,53.917749418173855,"Матусевича ул, 64, Минск",ИП Авсянский Павел Александрович,,65,,4,
1075929918,2026-07-05T18:03:05Z,Квартира,"Мечтаете просыпаться и видеть красивый город за окном? Ищете квартиру, в которой реально хочется жить, а не просто ночевать?

Сдаю уютную 1-комнатную",460.0,1318.73,False,https://re.kufar.by/vi/1075929918,31.0,1,10,23.0,25.0,,28,27.52721,53.868488,"Брилевская ул, 37, Минск",Яна,2.0,170,,,
1075928480,2026-07-05T17:46:26Z,Аренда 2-х комнатной квартиры в Минске,"Сдается в аренду с августа 2026г, уютная 2-х комнатная квартира от собственника на длительный срок в Минске, Центральный район, по адресу: ул. Карасто",418.59,1200.0,False,https://re.kufar.by/vi/1075928480,41.9,1,1,3.0,9.0,1966.0,22,27.565631,53.938956,"Лили Карастояновой ул, 41, Минск",Инна,2.0,,25.0,3,7.5
1075926336,2026-07-05T17:22:02Z,"Сдаю двухкомнатную квартиру, собственник","Собственник! Сдаю двухкомнатную квартиру в хорошем районе. В квартире одна спальня и зал, объединенный с кухней. 2 балкона. Вся техника, много шкафов.",700.0,2006.76,False,https://re.kufar.by/vi/1075926336,65.6,4,5,9.0,9.0,2014.0,23,27.591269,53.93672,"Гало ул, 76, Минск",Татьяна,4.0,220,35.2,,9.3
1075925737,2026-07-05T17:15:29Z,Квартира,"Все вопросы по телефону:
 Елена",453.47,1300.0,False,https://re.kufar.by/vi/1075925737,134.0,1,1,15.0,16.0,1985.0,26,27.668371,53.864894,"Варвашени ул, 1, Минск",Елена,,,17.0,3,8.0
1075925308,2026-07-05T17:11:15Z,"Аренда 3-комнатной квартиры в Минске, Притыцкого 115","Сдается в аренду просторная 3-комнатная в г.Минске в новом доме 2022 г. По улице Притыцкого 115.  Современный качественный ремонт, укомплектована мебе",976.7,2800.0,True,https://re.kufar.by/vi/1075925308,91.2,3,5,15.0,20.0,2022.0,30,27.425844,53.906761,"Притыцкого ул, 115, Минск",ООО Агентство Золотой ключ,3.0,,51.2,,13.6
1075920698,2026-07-05T16:52:53Z,Сдача квартиры,"После ремонта, всё новое, встроенная кухонная техника, новая сантехника, электрика, окна, двери,  плитка, натяжной потолок, безлимитный интернет от А1",505.79,1450.0,False,https://re.kufar.by/vi/1075920698,45.0,4,5,5.0,9.0,1968.0,24,27.64051706585159,53.943435417845336,"Калиновского ул, 99, Минск",Сергей,2.0,100,25.0,3,8.5
1075920110,2026-07-05T16:46:08Z,Сдам двухкомнатную квартиру в Соснах,"Сдам двухкомнатную квартиру 49 м2 семье без животных, по улице Красина, д.45. Квартира сдается с мебелью, имеется стиральная машина, электрочайник, хо",470.91,1350.0,False,https://re.kufar.by/vi/1075920110,49.0,2,,1.0,5.0,,26,27.76901,53.826444,"Академика Красина ул, 45, Минск",Татьяна,,250,,,7.5
1075918158,2026-07-05T16:31:44Z,Аренда квартиры,"Сдается однокомнатная квартира в долгосрочную аренду семейной паре.Ст.метро Грушевка,парк,магазины, поликлиника в шаговой доступности.Без животных.Ква",500.0,1433.4,False,https://re.kufar.by/vi/1075918158,50.0,1,5,14.0,24.0,2015.0,29,27.52148457991155,53.88840426260517,"Дзержинского пр, 11, Минск",Екатерина,2.0,55,20.0,10,11.0
1075916226,2026-07-05T16:25:22Z,Квартира в длительную аренду,"Сдаётся в центре на длительный срок 3-хкомнатная квартира с мебелью и бытовой техникой на Кирова, 19.
Этаж 2. Две отдельные спальни, в каждой - двуспа",750.0,2150.1,False,https://re.kufar.by/vi/1075916226,59.0,,5,,,,27,27.559082,53.897175,"Кирова ул, 19, Минск",Виктор,,,,3,
1075914898,2026-07-05T16:21:27Z,Сдам квартиру в Минск Мир,"Сдам квартиру студию в Минск Мире. На 22 этаже с прекрасными видами. До метро ""Аэродромная"" пешком 12 минут, рядом поликлиника, продуктовый магзин, ос",480.0,1376.06,False,https://re.kufar.by/vi/1075914898,32.0,3,5,22.0,25.0,2021.0,28,27.533597,53.86372,"Лейтенанта Кижеватова ул, 3Г, Минск",Светлана,2.0,170,25.2,,
1075914378,2026-07-05T16:16:09Z,Сдача квартиры,"Сдается евродвушка без мебели на длительный срок (от 1 года). Заключение договора обязательно. Закрытая территория для парковки, велобокс. До станции",500.0,1433.4,False,https://re.kufar.by/vi/1075914378,44.1,3,1,9.0,18.0,2025.0,24,27.669629,53.930756,"Навуковая ул, 10, Минск",Den,,,26.7,1,
1075910153,2026-07-05T15:37:00Z,Шикарная квартира в Минск-Мире,"Сдаётся светлая,красивая квартира в престижном доме ,метро возле подъезда.Окна смотрят на торговый и бизнес центр.В квартире прописан один человек,ком",558.11,1600.0,False,https://re.kufar.by/vi/1075910153,45.0,1,5,7.0,21.0,2020.0,28,27.549623,53.868801,"Мира пр, 1, Минск",Елена,2.0,170,35.0,2,10.0
1071866812,2026-07-05T15:26:02Z,Собственник сдает в аренду без посредников 4-комнатную квартиру по ул. Корш-Саблина,"Собственник сдает в аренду на длительный срок уютную, просторную 4-комнатную квартиру общей площадью 116 кв. м. по ул. Корш-Саблина (Советский район г",1000.0,2866.8,False,https://re.kufar.by/vi/1071866812,116.0,3,5,5.0,9.0,2008.0,23,27.590999,53.936015,"Корш-Саблина ул, 9, Минск",Алексей,,220,70.0,3,20.0
